{
  "name": "watercolor-basic",
  "version": "1",
  "tile-size": 512,
  "pad": 24,
  "background": "#f8f5e8",
  "layers": [
    {
      "type": "fill-solid",
      "id": "earth",
      "source-layer": "earth",
      "fill": "#f5eedc"
    },
    {
      "type": "fill-solid",
      "id": "landuse",
      "source-layer": "landuse",
      "fill": "#d6dfc5",
      "fill-alpha": 0.55
    },
    {
      "type": "fill-dabs",
      "id": "water",
      "source-layer": "water",
      "color": "#5876a0",
      "opacity": 0.22,
      "radius-px": 7.0,
      "hardness": 0.5,
      "paint": 1.0,
      "spacing-px": 3.0,
      "position-jitter": 0.9,
      "size-jitter": 0.4,
      "opacity-jitter": 0.3,
      "value-jitter": 0.08
    },
    {
      "type": "line",
      "id": "roads-primary",
      "source-layer": "roads",
      "min-zoom-field": "min_zoom",
      "filter": { "kind_detail": "primary" },
      "brush": "@watercolor_glazing",
      "color": "#8a6a52",
      "radius-px": 0.9,
      "opacity": 0.45,
      "pressure-base": 0.55,
      "pressure-jitter": 0.2,
      "dtime": 0.06
    },
    {
      "type": "line",
      "id": "roads-trunk",
      "source-layer": "roads",
      "min-zoom-field": "min_zoom",
      "filter": { "kind_detail": "trunk" },
      "brush": "@watercolor_glazing",
      "color": "#6a4f3a",
      "radius-px": 1.6,
      "opacity": 0.6,
      "pressure-base": 0.7,
      "pressure-jitter": 0.2,
      "dtime": 0.05
    },
    {
      "type": "line",
      "id": "roads-motorway",
      "source-layer": "roads",
      "min-zoom-field": "min_zoom",
      "filter": { "kind_detail": "motorway" },
      "brush": "@watercolor_glazing",
      "color": "#4a3424",
      "radius-px": 2.6,
      "opacity": 0.78,
      "pressure-base": 0.85,
      "pressure-jitter": 0.15,
      "dtime": 0.04
    }
  ]
}
